[
 {
  "key": "E44",
  "kind": "Epic",
  "title": "Live-enablement gating & environment separation",
  "labels": [
   "type/feature",
   "area/oms-execution",
   "priority/p0",
   "security",
   "qa",
   "design"
  ],
  "component": "api",
  "phase": "P4 Backtesting & Scripting",
  "sprint": "Sprint 20",
  "priority": "P0 Critical",
  "perspective": "Architecture",
  "risk": "R3 Real-time cost",
  "estimate": 73,
  "parent": null,
  "blocked_by": [
   "E38",
   "E39",
   "E43",
   "E42",
   "E29",
   "E27",
   "E09"
  ],
  "milestone": "R4 Live enablement",
  "body": "## Context\nR4 exists to produce **assurance, not features** (`docs/plan/30-release-roadmap.md` §8). E44 is the epic that makes the live/demo boundary *structural* rather than conventional: environment becomes a typed, validated configuration axis (M1 config, `docs/plan/24-internal-schemas.md` §16.1 `ExchangeConfig.environment`), it selects credentials, hosts and storage namespaces, and a master feature flag (`trading.live_enabled` / internal registry key `live_trading`, `docs/plan/24-internal-schemas.md` §16.2) defaults OFF and cannot be turned on until the four-item Live-enablement gate in `docs/plan/07-release-and-prr.md` §6 is satisfied with recorded evidence.\n\nEverything that can go wrong here is expensive: a demo credential reaching a live route, a live order sent from a session the user believed was demo, a manager promoted to live without an audited grant, or a deployment booting with a key that still carries withdrawal permission. E44 turns each of those from \"we were careful\" into \"the system refuses\".\n\nPlan references:\n- `docs/plan/30-release-roadmap.md` §3 (epic register, E44 = R4, `area/oms-execution`, modules M1/M14/M17, domains PAPER+ADMIN, 42 pts), §8.2-§8.3 (R4 scope and exit criteria 2 and 4).\n- `docs/plan/11-user-stories.md` §21 PAPER (US-PAPER-002, US-PAPER-003, US-PAPER-007) and §26 ADMIN (US-ADMIN-007, US-ADMIN-010, US-ADMIN-012).\n- `docs/plan/14-screens-catalogue.md` SCR-010, SCR-074, SCR-075, SCR-122, SCR-137, SCR-145.\n- `docs/plan/22-api-openapi.yaml` `POST /session/environment`, `PUT /admin/feature-flags/{flagKey}`, `GET /admin/feature-flags`, `GET /admin/security/summary`.\n- `docs/plan/23-ws-protocol.md` §auth_ok (`allowed_environments`), `system` topic (`SystemUpdate`, feature-flag + kill-switch broadcast).\n- `docs/plan/21-database-schema.md` §3 `exchange_accounts.env` / `exchange_env` enum / trigger `trg_ea_env_parent`, `trade_groups.tg_paper_env`.\n- `docs/plan/24-internal-schemas.md` §1 `Environment`/`ExecutionMode`, §14 authorization 4-tuple, §16.1 config validation, §16.2 flag registry, §16.3 admin knob map.\n- `docs/plan/07-release-and-prr.md` §6 Live-enablement gate.\n\n\n### Points reconciliation (register 42 vs epic estimate 75)\nThe §3 epic-register figure for E44 (**42 pts**) is an **engineering-only** budget: it counts Story / Task / Spike tickets (`S`, `T`, `K`) — the code-bearing work that consumes the R4 delivery-capacity line in `docs/plan/30-release-roadmap.md` §3.1. The epic ticket's `estimate` field is, per `docs/plan/02-definition-of-ready-done.md`, the **sum of all children**, which additionally includes the design (`D`), QA (`Q`) and security (`X`) tickets that are staffed from the design / QA / security disciplines rather than from the engineering capacity line.\n\n| Bucket | Tickets | Pts |\n|---|---|---|\n| Engineering (S/T/K) — comparable to the register's 42 | K01, T01–T06, S01–S04 | **45** |\n| Design (D) | D01–D04 | 11 |\n| QA / test (Q) | Q01–Q03 | 13 |\n| Security / compliance (X) | X01, X02 | 6 |\n| **Epic `estimate` (sum of children)** | | **75** |\n\nEngineering total **45** vs register **42** = **+7.1%**, inside the ±15% DoR tolerance. This is the same convention every other epic backlog file follows (e.g. E05 register 38 / epic 78, E11 register 89 / epic 154), so **no roadmap correction is required** — only an explanatory footnote, which E44-T06 adds to `docs/plan/30-release-roadmap.md` §3 so the convention is stated once for all epics rather than re-derived per file.\n\n## Scope / Deliverables\n**In scope**\n- Environment as a first-class typed setting (`live` | `demo` | `testnet`) resolved once at boot from `ExchangeConfig`, with an `environment_allowlist` that excludes `testnet` from user-selectable trading (E44-T01).\n- Physical storage separation for OMS-owned mutable state: a Postgres schema per environment and a QuestDB namespace per environment, with no shared mutable row reachable across environments (E44-T02).\n- One middleware-level cross-environment guard on every trading route, returning `403` and a high-severity audit event, plus the trade-group mixed-environment invariant (E44-T03).\n- `trading.live_enabled` master gate: flag registry entry, special-cased `PUT /admin/feature-flags/{flagKey}` requiring `reason` + `evidence_url`, gate-status computation feeding `GET /admin/security/summary` (E44-T04).\n- Key-permission audit CLI/job that prints Bybit-*reported* scopes for every configured key and blocks boot in `live` when an assertion fails (E44-T01, E44-T05).\n- UI: live-enablement gate surface on SCR-145 + SCR-137 (E44-S01), the hardened Demo→Live switch SCR-074 (E44-S02), the pervasive live visual language SCR-010/SCR-075 with confirm-on-every-order defaulting ON in live (E44-S03), and per-manager live eligibility on SCR-122 (E44-S04).\n- ADR-0016 recording the environment-separation decision (E44-T06).\n- Design (E44-D01..D04), QA (E44-Q01..Q03) and security (E44-X01..X02) tickets.\n\n**Story coverage (domains PAPER + ADMIN, E44 slice)**\n| Story | Ticket |\n|---|---|\n| US-PAPER-002 Explicit Demo↔Live switching (live half) | E44-S02, E44-S03 |\n| US-PAPER-003 Demo/Live isolation gating | E44-T02, E44-T03, E44-S03 |\n| US-PAPER-007 Demo eligibility per manager | E44-S04 |\n| US-ADMIN-007 Feature flags (safety-flag half) | E44-T04, E44-S01 |\n| US-ADMIN-010 Security posture panel (gate + key-scope half) | E44-T05, E44-S01 |\n| US-ADMIN-012 Live-trading enablement gate | E44-T04, E44-S01 |\n\n## Out of scope\n- The demo trading integration itself, paper P&L and reset, and the parity report (US-PAPER-001/004/005/006/008) — owned by **E38 Paper trading & demo/live parity** (R3).\n- Kill-switch and risk caps mechanics — **E39** (R3); E44 only consumes them.\n- The pen-test itself and its remediation — **E43**.\n- Reconciliation, dead-man's-switch and the chaos suite — **E45**.\n- The generic admin screens (users, roles, audit browser, health) — **E42**; E44 only adds the gate widgets onto SCR-137/SCR-145 and the eligibility control onto SCR-122.\n- Android and any separate admin application (owner decision 2026-09-14).\n- Non-Bybit exchanges and non-USDT-perp instruments.\n\n## Acceptance criteria (epic outcome)\n```gherkin\nScenario: Live is structurally unreachable until the gate passes\n  Given a deployment where the Live-enablement gate has any of its four items outstanding\n  When the owner opens SCR-145 and attempts to enable trading.live_enabled\n  Then the toggle is disabled, the outstanding items are listed by name with a link to SCR-137\n  And PUT /admin/feature-flags/trading.live_enabled returns 422 validation_failed / gate_evidence_required\n\nScenario: No process can cross the environment boundary\n  Given a process booted with environment=live\n  When it attempts any read or write against the demo Postgres schema or the demo QuestDB namespace\n  Then the attempt fails at the connection/grant level, not merely in application code\n  And the isolation assertion suite (E44-Q01) proves it in both directions\n\nScenario: A live-credentialed boot with an unsafe key refuses to start\n  Given any configured key for a live account reports withdrawal scope enabled or an empty IP allowlist\n  When the service starts with environment=live\n  Then startup aborts with a fatal, actionable log line naming the account and the failing assertion\n  And no listener is bound and no exchange session is opened\n\nScenario: Live is unmistakable everywhere\n  Given the session environment is live\n  Then SCR-010 chrome, every trading-capable panel badge (SCR-075) and every order confirmation restate LIVE as text plus icon plus pattern, never colour alone\n  And confirm-on-every-order is ON by default and cannot be silenced with \"don't ask again\" in live\n```\n\n## Technical notes / design\n- `Environment` is a single vocabulary shared by `docs/plan/24-internal-schemas.md` §1, the OpenAPI `Environment` schema and the Postgres `exchange_env` enum; the existing contract test `enum_parity_environment` must remain green.\n- `Environment` (which credentials/account) and `ExecutionMode` (who filled it) stay orthogonal — never collapsed. Paper-ness is the `is_paper` boolean.\n- Authorization stays the 4-tuple `(permission, account_id ∈ granted accounts, symbol ∈ allowed_symbols, environment enabled)` in a single `authorize()`; E44 adds no new permission for \"live\" (`docs/plan/24-internal-schemas.md` §14).\n- Flag resolution order and the environment-scoped override are already specified (`docs/plan/24-internal-schemas.md` §16.2); E44 uses the `environment` override scope rather than inventing per-env flag tables.\n- Error codes used by this epic: `live_trading_disabled`, `step_up_required`, `environment_mismatch`, `gate_evidence_required`, `live_not_permitted_for_user`.\n\n## Test plan\nPer-child; rolled up by E44-Q01..Q03. Epic-level gates: isolation assertion suite green in both directions; a Playwright E2E that walks gate-blocked → gate-satisfied → enable → switch → live badge → live order confirm; an axe-core pass over SCR-074/075/122/137/145; a security review sign-off from E44-X02.\n\n## Security notes\nThis epic is the last structural barrier between the product and real money. Threats (STRIDE, modelled in E44-X01): spoofing a live session from a demo client; tampering with the flag value directly in Postgres; repudiation of who enabled live; information disclosur